{
  "id": "quiz-children-010",
  "title": "Noah's Ark Quiz 10",
  "description": "Questions about Noah's Ark for children - Part 10",
  "difficulty": "beginner",
  "questions": [
    {
      "id": "q-100",
      "text": "True or False: Noah obeyed everything God told him to do.",
      "type": "true-false",
      "bibleReference": {
        "book": "Genesis",
        "chapter": 6,
        "verses": "22"
      },
      "options": [
        {
          "id": "opt-100",
          "text": "True",
          "isCorrect": true,
          "explanation": "Genesis 6:22 says 'Thus did Noah; according to all that God commanded him, so did he.'"
        },
        {
          "id": "opt-101",
          "text": "False",
          "isCorrect": false,
          "explanation": "Noah was completely obedient to God's commands."
        }
      ],
      "points": 1
    }
  ],
  "passingScore": 50,
  "timeLimit": 0
}
